{
  "report_version": "0.1.0",
  "bundle_id": "bundle-0a1b2c3d4e5f-v0_1_0",
  "gate_results": {
    "trigger": {
      "precision": 0.95,
      "recall": 0.92,
      "passed": true
    },
    "output": {
      "mechanical_pass_rate": 1.0,
      "passed": true
    },
    "end_to_end": {
      "verdict": "pass",
      "winning_pairs": 5,
      "style_fit_median": 4.2,
      "pairing_median_delta": 0.9,
      "quality_median_delta": -0.1,
      "undetermined_dimensions": [],
      "passed": true
    }
  },
  "summary": {
    "final_state": "ready",
    "notes": "synthetic happy-path"
  }
}